{
  "question_id": "question_kv_cache_reuse_demo_001",
  "project_id": "project_kv_cache_reuse_demo",
  "question": "Does strict template matching preserve quality when cache reuse is evaluated on longer synthetic contexts?",
  "priority": "high",
  "status": "open",
  "evidence_ids": ["run_example_negative_001"],
  "next_action": "Run a longer-context synthetic benchmark with strict and relaxed matching.",
  "created_at": "2026-01-02T00:00:00+00:00"
}
